{
  "id": "evt-gov-cycle-2026-09-23T00-36-30-556Z",
  "entity_id": "atlas://bot/organism-alpha-bot",
  "op": "governance_cycle_completed",
  "ts": "2026-09-23T00:36:30.557Z",
  "context": {
    "status": "pass",
    "risk_score": 0.25,
    "health_dashboard": {
      "overall": "green"
    },
    "metrics": {
      "eventCount": 563,
      "lawsFired": 1,
      "forbids": 0,
      "warnings": 1
    }
  },
  "tags": [
    "bot",
    "alpha",
    "governance",
    "division-vii"
  ],
  "schema_version": "1.0.0"
}